"Variable","Variable Label","Possible Values","Column Type","Column Name"
"SERNUM","Sernum","","int64","Sernum"
"BENUNIT","Benefit Unit","","int64","Benefit_Unit"
"ADBTBL","Keep up with bills and regular debt repayments","Yes , No ","object","Keep_up_with_bills_and_regular_debt_repayments"
"ADDDEC","enough money to keep your home in a decent state of décor","Adult(s) have this , Adult(s) would like to have this but cannot afford , Adult(s) do not want / need this , Does not apply ","object","enough_money_to_keep_your_home_in_a_decent_state_of_dcor"
"ADDHOL","hols away from home one week a year+ not staying with rels","Adult(s) have this , Adult(s) would like to have this but cannot afford , Adult(s) do not want / need this , Does not apply ","object","hols_away_from_home_one_week_a_year_not_staying_with_rels"
"ADDHOLR","hols away from home one week a year staying with rels","Adult(s) have this , Adult(s) would like to have this but cannot afford , Adult(s) do not want / need this , Does not apply ","object","hols_away_from_home_one_week_a_year_staying_with_rels"
"ADDINS","household contents insurance","Adult(s) have this , Adult(s) would like to have this but cannot afford , Adult(s) do not want / need this , Does not apply ","object","household_contents_insurance"
"ADDMON","make savings of £10 a month or more","Adult(s) do this , Adult(s) would like to do this but cannot afford , Adult(s) do not want / need this , Does not apply ","object","make_savings_of_10_a_month_or_more"
"ADEPFUR","replace any worn out furniture","Adult(s) do this , Adult(s) would like to do this but cannot afford , Adult(s) do not want / need this , Does not apply ","object","replace_any_worn_out_furniture"
"ADLES","Do you regularly participate in a hobby or leisure activity?","Adult(s) have this , Adult(s) would like to have this but cannot afford , Adult(s) do not want / need this , Does not apply ","object","Do_you_regularly_participate_in_a_hobby_or_leisure_activity"
"ADLESNT1","Why no regular leisure activity: no money for this","Yes , No , None ","object","Why_no_regular_leisure_activity_no_money_for_this"
"ADLESNT2","Why no regular leisure activity: not priority on current income","Yes , No , None ","object","Why_no_regular_leisure_activity_not_priority_on_current_income"
"ADLESNT3","Why no regular leisure activity: health,disability prevents me","Yes , No , None ","object","Why_no_regular_leisure_activity_healthdisability_prevents_me"
"ADLESNT4","Why no regular leisure activity: too much trouble,too tiring","Yes , No , None ","object","Why_no_regular_leisure_activity_too_much_troubletoo_tiring"
"ADLESNT5","Why no regular leisure activity: no one to do this with or help me","Yes , No , None ","object","Why_no_regular_leisure_activity_no_one_to_do_this_with_or_help"
"ADLESNT6","Why no regular leisure activity: Not something I want","Yes , No , None ","object","Why_no_regular_leisure_activity_Not_something_I_want"
"ADLESNT7","Why no regular leisure activity: not relevant to me","Yes , No , None ","object","Why_no_regular_leisure_activity_not_relevant_to_me"
"ADLESNT8","Why no regular leisure activity: Other reason","Yes , No , None ","object","Why_no_regular_leisure_activity_Other_reason"
"ADLESOA","Do you regularly participate in a hobby or leisure activity?","Yes , No ","object","Do_you_regularly_participate_in_a_hobby_or_leisure_activity"
"AF1","replace or repair broken electrical goods","Adult(s) do this , Adult(s) would like to do this but cannot afford , Adult(s) do not want / need this , Does not apply ","object","replace_or_repair_broken_electrical_goods"
"AFDEP2","money to spend each week on yourself, not on your family","Adult(s) do this , Adult(s) would like to do this but cannot afford , Adult(s) do not want / need this , Does not apply ","object","money_to_spend_each_week_on_yourself_not_on_your_family"
"BILLNT1","Why not pay bills: no money for this","Yes , No , Not applicable ","object","Why_not_pay_bills_no_money_for_this"
"BILLNT2","Why not pay bills: not priority on current income","Yes , No , Not applicable ","object","Why_not_pay_bills_not_priority_on_current_income"
"BILLNT3","Why not pay bills: health,disability prevents me","Yes , No , Not applicable ","object","Why_not_pay_bills_healthdisability_prevents_me"
"BILLNT4","Why not pay bills: too much trouble,too tiring","Yes , No , Not applicable ","object","Why_not_pay_bills_too_much_troubletoo_tiring"
"BILLNT5","Why not pay bills: no one to do this with or help me","Yes , No , Not applicable ","object","Why_not_pay_bills_no_one_to_do_this_with_or_help_me"
"BILLNT6","Why not pay bills: not something I want","Yes , No , Not applicable ","object","Why_not_pay_bills_not_something_I_want"
"BILLNT7","Why not pay bills: not relevant to me","Yes , No , Not applicable ","object","Why_not_pay_bills_not_relevant_to_me"
"BILLNT8","Why not pay bills: other reason","Yes , No , Not applicable ","object","Why_not_pay_bills_other_reason"
"BILLNT9","Do not know","Yes , No , Not applicable ","object","Do_not_know"
"CDELPLY","outdoor space,facilities nearby where kids play in safety","Yes , No ","object","outdoor_spacefacilities_nearby_where_kids_play_in_safety"
"CDEPACT","Attends regular organised activity outside school each week","Child(ren) do this , Child(ren) would like to do this but we cannot afford , Child(ren) do not want /need this , Does not apply ","object","Attends_regular_organised_activity_outside_school_each_week"
"CDEPBED","enough bedrooms for every child over 10","Child(ren) have this , Child(ren) would like to have this but we cannot afford , Child(ren) do not want / need this , Does not apply ","object","enough_bedrooms_for_every_child_over_10"
"CDEPCEL","celebrations on special occasions","Child(ren) have this , Child(ren) would like to have this but we cannot afford , Child(ren) do not want / need this , Does not apply ","object","celebrations_on_special_occasions"
"CDEPEQP","leisure equipment such as sports equipment or a bicycle","Child(ren) have this , Child(ren) would like to have this but we cannot afford , Child(ren) do not want / need this , Does not apply ","object","leisure_equipment_such_as_sports_equipment_or_a_bicycle"
"CDEPHOL","a holiday away from home at least 1 week a year with family","Child(ren) have this , Child(ren) would like to have this but we cannot afford , Child(ren) do not want / need this , Does not apply ","object","a_holiday_away_from_home_at_least_1_week_a_year_with_family"
"CDEPLES","a hobby or leisure activity","Child(ren) do this , Child(ren) would like to do this but we cannot afford , Child(ren) do not want /need this , Does not apply ","object","a_hobby_or_leisure_activity"
"CDEPTEA","have friends round for tea or a snack once a fortnight","Child(ren) do this , Child(ren) would like to do this but we cannot afford , Child(ren) do not want /need this , Does not apply ","object","have_friends_round_for_tea_or_a_snack_once_a_fortnight"
"CDEPTRP","go on a school trip at least once a term","Child(ren) do this , Child(ren) would like to do this but we cannot afford , Child(ren) do not want /need this , Does not apply ","object","go_on_a_school_trip_at_least_once_a_term"
"CDEPVEG","Eat fresh fruit or veg every day","Child(ren) have this , Child(ren) would like to have this but we cannot afford , Child(ren) do not want / need this , Does not apply ","object","Eat_fresh_fruit_or_veg_every_day"
"CDPCOAT","Have a warm winter coat","Child(ren) have this , Child(ren) would like to have this but we cannot afford , Child(ren) do not want / need this , Does not apply ","object","Have_a_warm_winter_coat"
"CLOTHES","Do you replace worn-out clothes with new ones?","Adult(s) have this , Adult(s) would like to have this but cannot afford , Adult(s) do not want / need this , Does not apply ","object","Do_you_replace_wornout_clothes_with_new_ones"
"CLOTHNT1","Why do not replace worn-out clothes: No money for this","Yes , No , None ","object","Why_do_not_replace_wornout_clothes_No_money_for_this"
"CLOTHNT2","Why do not replace worn-out clothes: Not priority on current income","Yes , No , None ","object","Why_do_not_replace_wornout_clothes_Not_priority_on_current_inc"
"CLOTHNT3","Why do not replace worn-out clothes: Health,disability prevents me","Yes , No , None ","object","Why_do_not_replace_wornout_clothes_Healthdisability_prevents_m"
"CLOTHNT4","Why do not replace worn-out clothes: Too much trouble,too tiring","Yes , No , None ","object","Why_do_not_replace_wornout_clothes_Too_much_troubletoo_tiring"
"CLOTHNT5","Why do not replace worn-out clothes: No one to do this with or help me","Yes , No , None ","object","Why_do_not_replace_wornout_clothes_No_one_to_do_this_with_or_h"
"CLOTHNT6","Why do not replace worn-out clothes: Not something I want","Yes , No , None ","object","Why_do_not_replace_wornout_clothes_Not_something_I_want"
"CLOTHNT7","Why do not replace worn-out clothes: Not relevant to me","Yes , No , None ","object","Why_do_not_replace_wornout_clothes_Not_relevant_to_me"
"CLOTHNT8","Why do not replace worn-out clothes: Other reason","Yes , No , None ","object","Why_do_not_replace_wornout_clothes_Other_reason"
"CLOTHSOA","Do you replace worn-out clothes with new ones?","Yes , No ","object","Do_you_replace_wornout_clothes_with_new_ones"
"COATNT1","Why no waterproof coat: no money for this","Yes , No , Not applicable ","object","Why_no_waterproof_coat_no_money_for_this"
"COATNT2","Why no waterproof coat: not priority on current income","Yes , No , Not applicable ","object","Why_no_waterproof_coat_not_priority_on_current_income"
"COATNT3","Why no waterproof coat: health,disability prevents me","Yes , No , Not applicable ","object","Why_no_waterproof_coat_healthdisability_prevents_me"
"COATNT4","Why no waterproof coat: too much trouble,too tiring","Yes , No , Not applicable ","object","Why_no_waterproof_coat_too_much_troubletoo_tiring"
"COATNT5","Why no waterproof coat: no one to do this with or help me","Yes , No , Not applicable ","object","Why_no_waterproof_coat_no_one_to_do_this_with_or_help_me"
"COATNT6","Why no waterproof coat: not something I want","Yes , No , Not applicable ","object","Why_no_waterproof_coat_not_something_I_want"
"COATNT7","Why no waterproof coat: not relevant to me","Yes , No , Not applicable ","object","Why_no_waterproof_coat_not_relevant_to_me"
"COATNT8","Why no waterproof coat: other reason","Yes , No , Not applicable ","object","Why_no_waterproof_coat_other_reason"
"COATNT9","Do not know","Yes , No , Not applicable ","object","Do_not_know"
"COMPUTER","Does your household have a home computer","Yes , No ","object","Does_your_household_have_a_home_computer"
"COMPUWHY","Why dont your household have a home computer Is it because","Don't want one , Would like one but cannot afford it , Or is there some other reason? ","object","Why_dont_your_household_have_a_home_computer_Is_it_because"
"COOKNT1","Why not replace cooker: no money for this","Yes , No , Not applicable ","object","Why_not_replace_cooker_no_money_for_this"
"COOKNT2","Why not replace cooker: not priority on current income","Yes , No , Not applicable ","object","Why_not_replace_cooker_not_priority_on_current_income"
"COOKNT3","Why not replace cooker: health,disability prevents me","Yes , No , Not applicable ","object","Why_not_replace_cooker_healthdisability_prevents_me"
"COOKNT4","Why not replace cooker: too much trouble,too tiring","Yes , No , Not applicable ","object","Why_not_replace_cooker_too_much_troubletoo_tiring"
"COOKNT5","Why not replace cooker: no one to do this with or help me","Yes , No , Not applicable ","object","Why_not_replace_cooker_no_one_to_do_this_with_or_help_me"
"COOKNT6","Why not replace cooker: not something I want","Yes , No , Not applicable ","object","Why_not_replace_cooker_not_something_I_want"
"COOKNT7","Why not replace cooker: not relevant to me","Yes , No , Not applicable ","object","Why_not_replace_cooker_not_relevant_to_me"
"COOKNT8","Why not replace cooker: other reason","Yes , No , Not applicable ","object","Why_not_replace_cooker_other_reason"
"COOKNT9","Do not know","Yes , No , Not applicable ","object","Do_not_know"
"CPLAY","Go to a playgroup at least once a week","Child(ren) do this , Child(ren) would like to do this but we cannot afford , Child(ren) do not want /need this , Does not apply ","object","Go_to_a_playgroup_at_least_once_a_week"
"CRIME","Do you have crime,violence,vandalism in the area","Yes , No ","object","Do_you_have_crimeviolencevandalism_in_the_area"
"DAMP","Does accom have leaking roof, damp walls,floors,foundations","Yes , No ","object","Does_accom_have_leaking_roof_damp_wallsfloorsfoundations"
"DAMPNT1","Why no damp free home: no money for this","Yes , No , Not applicable ","object","Why_no_damp_free_home_no_money_for_this"
"DAMPNT2","Why no damp free home: not priority on current income","Yes , No , Not applicable ","object","Why_no_damp_free_home_not_priority_on_current_income"
"DAMPNT3","Why no damp free home: health,disability prevents me","Yes , No , Not applicable ","object","Why_no_damp_free_home_healthdisability_prevents_me"
"DAMPNT4","Why no damp free home: too much trouble,too tiring","Yes , No , Not applicable ","object","Why_no_damp_free_home_too_much_troubletoo_tiring"
"DAMPNT5","Why no damp free home: no one to do this with or help me","Yes , No , Not applicable ","object","Why_no_damp_free_home_no_one_to_do_this_with_or_help_me"
"DAMPNT6","Why no damp free home: not something I want","Yes , No , Not applicable ","object","Why_no_damp_free_home_not_something_I_want"
"DAMPNT7","Why no damp free home: not relevant to me","Yes , No , Not applicable ","object","Why_no_damp_free_home_not_relevant_to_me"
"DAMPNT8","Why no damp free home: other reason","Yes , No , Not applicable ","object","Why_no_damp_free_home_other_reason"
"DAMPNT9","Do not know","Yes , No , Not applicable ","object","Do_not_know"
"DARK","Is your accom too dark or not enough daylight","Yes , No ","object","Is_your_accom_too_dark_or_not_enough_daylight"
"DEBT01","Behind with the electricity bill","Yes , No , None ","object","Behind_with_the_electricity_bill"
"DEBT02","Behind with the gas bill","Yes , No , None ","object","Behind_with_the_gas_bill"
"DEBT03","Behind with other fuel bills like coal or oil","Yes , No , None ","object","Behind_with_other_fuel_bills_like_coal_or_oil"
"DEBT04","Behind with Council Tax","Yes , No , None ","object","Behind_with_Council_Tax"
"DEBT05","Behind with insurance policies","Yes , No , None ","object","Behind_with_insurance_policies"
"DEBT06","Behind with telephone bill","Yes , No , None ","object","Behind_with_telephone_bill"
"DEBT07","Behind with television,video rental or HP","Yes , No , None ","object","Behind_with_televisionvideo_rental_or_HP"
"DEBT08","Behind with other HP payments","Yes , No , None ","object","Behind_with_other_HP_payments"
"DEBT09","Behind with water rates,rates(NI)","Yes , No , None ","object","Behind_with_water_ratesratesNI"
"DEBT10","Behind with rent","Yes , No , None ","object","Behind_with_rent"
"DEBT11","Behind with mortgage payments","Yes , No , None ","object","Behind_with_mortgage_payments"
"DEBT12","Behind with other loans","Yes , No , None ","object","Behind_with_other_loans"
"DEBT13","Behind with other loan repayments","Yes , No , None ","object","Behind_with_other_loan_repayments"
"DEBTAR01","Been behind with the electricity bill in last 12 months","Yes , No , None ","object","Been_behind_with_the_electricity_bill_in_last_12_months"
"DEBTAR02","Been behind with the gas bill in last 12 months","Yes , No , None ","object","Been_behind_with_the_gas_bill_in_last_12_months"
"DEBTAR03","Been behind with other fuel bills in last 12 months","Yes , No , None ","object","Been_behind_with_other_fuel_bills_in_last_12_months"
"DEBTAR04","Been behind with Council Tax in last 12 months","Yes , No , None ","object","Been_behind_with_Council_Tax_in_last_12_months"
"DEBTAR05","Been behind with insurance policies in last 12 months","Yes , No , None ","object","Been_behind_with_insurance_policies_in_last_12_months"
"DEBTAR06","Been behind with telephone bill in last 12 months","Yes , No , None ","object","Been_behind_with_telephone_bill_in_last_12_months"
"DEBTAR07","Been behind with tele,video rental or HP in last 12 months","Yes , No , None ","object","Been_behind_with_televideo_rental_or_HP_in_last_12_months"
"DEBTAR08","Been behind with other HP payments in last 12 months","Yes , No , None ","object","Been_behind_with_other_HP_payments_in_last_12_months"
"DEBTAR09","Been behind with water rates,rates(NI) in last 12 months","Yes , No , None ","object","Been_behind_with_water_ratesratesNI_in_last_12_months"
"DEBTAR10","Been behind with rent in last 12 months","Yes , No , None ","object","Been_behind_with_rent_in_last_12_months"
"DEBTAR11","Been behind with mortgage payments in last 12 months","Yes , No , None ","object","Been_behind_with_mortgage_payments_in_last_12_months"
"DEBTAR12","Been behind with other loans in last 12 months","Yes , No , None ","object","Been_behind_with_other_loans_in_last_12_months"
"DEBTAR13","Been behind with other loan repayments i","Yes , No , None ","object","Been_behind_with_other_loan_repayments_i"
"DEBTFRE1","How many times behind with mortgage,rent in last yr","One , Two or more ","object","How_many_times_behind_with_mortgagerent_in_last_yr"
"DEBTFRE2","How many times behind with elec,gas,water,fuel in last yr","One , Two or more ","object","How_many_times_behind_with_elecgaswaterfuel_in_last_yr"
"DEBTFRE3","How many times behind with other loan repayments in last yr","One , Two or more ","object","How_many_times_behind_with_other_loan_repayments_in_last_yr"
"ENDSMEET","Whether the household is able to make ends meet","With great difficulty , With difficulty , With some difficulty , Fairly easily , Easily , Very easily ","object","Whether_the_household_is_able_to_make_ends_meet"
"EUCAR","Do you own, or have continuous use of any motor vehicles","Yes , No ","object","Do_you_own_or_have_continuous_use_of_any_motor_vehicles"
"EUCARWHY","Why do you not have access to a motor vehicle","Don't want one , Would like one but cannot afford it , Or is there some other reason? ","object","Why_do_you_not_have_access_to_a_motor_vehicle"
"EUEXPNS","Able to pay unexpected but necessary expense of £750","Yes , No ","object","Able_to_pay_unexpected_but_necessary_expense_of_750"
"EUMEAL","Afford to eat meat or fish every second day","Yes , No ","object","Afford_to_eat_meat_or_fish_every_second_day"
"EUREPAY","Anyone in hhold have credit card or other loan to repay","Yes , No ","object","Anyone_in_hhold_have_credit_card_or_other_loan_to_repay"
"EUROAST","Does your household have a roast joint (or equivalent) once a week?","Adult(s) do this , Adult(s) would like to do this but cannot afford , Adult(s) do not want / need this , Does not apply ","object","Does_your_household_have_a_roast_joint_or_equivalent_once_a_we"
"EUSMEAL","In the last 14 days was there a day you, partner not have substantial meal?","Yes , No ","object","In_the_last_14_days_was_there_a_day_you_partner_not_have_subst"
"EUTELEPH","Does your household have a telephone to use whenever needed","Yes, a fixed telephone , Yes, a mobile telephone , Yes, both a fixed and mobile telephone , No ","object","Does_your_household_have_a_telephone_to_use_whenever_needed"
"EUTELWHY","Why dont your hhold have a telephone to use when needed","Don't want one , Would like one but cannot afford it , Or is there some other reason? ","object","Why_dont_your_hhold_have_a_telephone_to_use_when_needed"
"EXPNSOA","Able to pay unexpected but necessary expense of £750","Yes , No ","object","Able_to_pay_unexpected_but_necessary_expense_of_750"
"FRNDNT1","Why not see friends,family: no money for this","Yes , No , Not applicable ","object","Why_not_see_friendsfamily_no_money_for_this"
"FRNDNT2","Why not see friends,family: not priority on current income","Yes , No , Not applicable ","object","Why_not_see_friendsfamily_not_priority_on_current_income"
"FRNDNT3","Why not see friends,family: health,disability prevents me","Yes , No , Not applicable ","object","Why_not_see_friendsfamily_healthdisability_prevents_me"
"FRNDNT4","Why not see friends,family: too much trouble,too tiring","Yes , No , Not applicable ","object","Why_not_see_friendsfamily_too_much_troubletoo_tiring"
"FRNDNT5","Why not see friends,family: no one to do this with or help","Yes , No , Not applicable ","object","Why_not_see_friendsfamily_no_one_to_do_this_with_or_help"
"FRNDNT6","Why not see friends,family: not something I want","Yes , No , Not applicable ","object","Why_not_see_friendsfamily_not_something_I_want"
"FRNDNT7","Why not see friends,family: not relevant to me","Yes , No , Not applicable ","object","Why_not_see_friendsfamily_not_relevant_to_me"
"FRNDNT8","Why not see friends,family: other reason","Yes , No , Not applicable ","object","Why_not_see_friendsfamily_other_reason"
"FRNDNT9","Do not know","Yes , No , Not applicable ","object","Do_not_know"
"FURNT1","Why do not replace worn-out furniture: No money for this","Yes , No , None ","object","Why_do_not_replace_wornout_furniture_No_money_for_this"
"FURNT2","Why do not replace worn-out furniture: Not priority on current income","Yes , No , None ","object","Why_do_not_replace_wornout_furniture_Not_priority_on_current_i"
"FURNT3","Why do not replace worn-out furniture: Health,disability prevents me","Yes , No , None ","object","Why_do_not_replace_wornout_furniture_Healthdisability_prevents"
"FURNT4","Why do not replace worn-out furniture: Too much trouble,too tiring","Yes , No , None ","object","Why_do_not_replace_wornout_furniture_Too_much_troubletoo_tirin"
"FURNT5","Why do not replace worn-out furniture: No one to do this with or help me","Yes , No , None ","object","Why_do_not_replace_wornout_furniture_No_one_to_do_this_with_or"
"FURNT6","Why do not replace worn-out furniture: Not something I want","Yes , No , None ","object","Why_do_not_replace_wornout_furniture_Not_something_I_want"
"FURNT7","Why do not replace worn-out furniture: Not relevant to me","Yes , No , None ","object","Why_do_not_replace_wornout_furniture_Not_relevant_to_me"
"FURNT8","Why do not replace worn-out furniture: Other reason","Yes , No , None ","object","Why_do_not_replace_wornout_furniture_Other_reason"
"HAIRNT1","Why hair not done,cut regularly: no money for this","Yes , No , Not applicable ","object","Why_hair_not_donecut_regularly_no_money_for_this"
"HAIRNT2","Why hair not done,cut regularly: not priority on current inc","Yes , No , Not applicable ","object","Why_hair_not_donecut_regularly_not_priority_on_current_inc"
"HAIRNT3","Why hair not done,cut regularly: health,disability prevents","Yes , No , Not applicable ","object","Why_hair_not_donecut_regularly_healthdisability_prevents"
"HAIRNT4","Why hair not done,cut regularly: too much trouble,too tiring","Yes , No , Not applicable ","object","Why_hair_not_donecut_regularly_too_much_troubletoo_tiring"
"HAIRNT5","Why hair not done,cut regularly: no one to do this with,help","Yes , No , Not applicable ","object","Why_hair_not_donecut_regularly_no_one_to_do_this_withhelp"
"HAIRNT6","Why hair not done,cut regularly: not something I want","Yes , No , Not applicable ","object","Why_hair_not_donecut_regularly_not_something_I_want"
"HAIRNT7","Why hair not done,cut regularly: not relevant to me","Yes , No , Not applicable ","object","Why_hair_not_donecut_regularly_not_relevant_to_me"
"HAIRNT8","Why hair not done,cut regularly: other reason","Yes , No , Not applicable ","object","Why_hair_not_donecut_regularly_other_reason"
"HAIRNT9","Do not know","Yes , No , Not applicable ","object","Do_not_know"
"HBOLNG","Time been on Housing Benefit or Rent [rebate,Allowance]","Up to 2 Years , 2 Years but less than 3 , 3 Years but less than 4 , 4 Years but less than 5 , 5 or more Years ","object","Time_been_on_Housing_Benefit_or_Rent_rebateAllowance"
"HBOTHAMT","Amount of Housing Benefit,rent rebate,rent or rates rebate","","float64","Amount_of_Housing_Benefitrent_rebaterent_or_rates_rebate"
"HBOTHBU","Whether qualifies for HB (2nd+ BU)","Yes , No ","object","Whether_qualifies_for_HB_2nd_BU"
"HBOTHMN","Month began current Housing Benefit claim","January , February , March , April , May , June , July , August , September , October , November , December ","object","Month_began_current_Housing_Benefit_claim"
"HBOTHPD","Pcode : Housing Benefit","1 week , 2 weeks , 3 weeks , 4 weeks , Calendar month , Two Calendar months , Eight times a year , Nine times a year , Ten times a year , Three months (13 weeks) , One Year/12  Months/52 Weeks , Other , Six months/26 Weeks , Less than 1 week , One off/lump sum ","object","Pcode__Housing_Benefit"
"HBOTHWK","Number of weeks claimed Housing Benefit","","int64","Number_of_weeks_claimed_Housing_Benefit"
"HBOTHYR","Year began current Housing Benefit claim","Year 2006 , Year 2007 , Year 2008 , Year 2009 ","int64","Year_began_current_Housing_Benefit_claim"
"HBOTWAIT","Awaiting outcome of Housing Benft claim","Yes , No ","int64","Awaiting_outcome_of_Housing_Benft_claim"
"HEATNT1","Why heating etc not in working order: no money for this","Yes , No , Not applicable ","object","Why_heating_etc_not_in_working_order_no_money_for_this"
"HEATNT2","Why heating etc not in working order: not priority on income","Yes , No , Not applicable ","object","Why_heating_etc_not_in_working_order_not_priority_on_income"
"HEATNT3","Why heating etc not in working order: health,disability","Yes , No , Not applicable ","object","Why_heating_etc_not_in_working_order_healthdisability"
"HEATNT4","Why heating etc not in working order:too much trouble,too tiring","Yes , No , Not applicable ","object","Why_heating_etc_not_in_working_ordertoo_much_troubletoo_tiring"
