"Variable","Variable Label","Possible Values","Column Type","Column Name"
"HEATNT5","Why heating etc not in working order: no one to do this with","Yes , No , Not applicable ","object","Why_heating_etc_not_in_working_order_no_one_to_do_this_with"
"HEATNT6","Why heating etc not in working order: not something I want","Yes , No , Not applicable ","object","Why_heating_etc_not_in_working_order_not_something_I_want"
"HEATNT7","Why heating etc not in working order: not relevant to me","Yes , No , Not applicable ","object","Why_heating_etc_not_in_working_order_not_relevant_to_me"
"HEATNT8","Why heating etc not in working order: other reason","Yes , No , Not applicable ","object","Why_heating_etc_not_in_working_order_other_reason"
"HEATNT9","Do not know","Yes , No , Not applicable ","object","Do_not_know"
"HOLNT1","Why no holiday: no money for this","Yes , No , Not applicable ","object","Why_no_holiday_no_money_for_this"
"HOLNT2","Why no holiday: not priority on current income","Yes , No , Not applicable ","object","Why_no_holiday_not_priority_on_current_income"
"HOLNT3","Why no holiday: health,disability prevents me","Yes , No , Not applicable ","object","Why_no_holiday_healthdisability_prevents_me"
"HOLNT4","Why no holiday: too much trouble,too tiring","Yes , No , Not applicable ","object","Why_no_holiday_too_much_troubletoo_tiring"
"HOLNT5","Why no holiday: no one to do this with or help me","Yes , No , Not applicable ","object","Why_no_holiday_no_one_to_do_this_with_or_help_me"
"HOLNT6","Why no holiday: not something I want","Yes , No , Not applicable ","object","Why_no_holiday_not_something_I_want"
"HOLNT7","Why no holiday: not relevant to me","Yes , No , Not applicable ","object","Why_no_holiday_not_relevant_to_me"
"HOLNT8","Why no holiday: other reason","Yes , No , Not applicable ","object","Why_no_holiday_other_reason"
"HOLNT9","Do not know","Yes , No , Not applicable ","object","Do_not_know"
"HOMENT1","Why home not in good repair: no money for this","Yes , No , Not applicable ","object","Why_home_not_in_good_repair_no_money_for_this"
"HOMENT2","Why home not in good repair: not priority on current income","Yes , No , Not applicable ","object","Why_home_not_in_good_repair_not_priority_on_current_income"
"HOMENT3","Why home not in good repair: health,disability prevents me","Yes , No , Not applicable ","object","Why_home_not_in_good_repair_healthdisability_prevents_me"
"HOMENT4","Why home not in good repair: too much trouble,too tiring","Yes , No , Not applicable ","object","Why_home_not_in_good_repair_too_much_troubletoo_tiring"
"HOMENT5","Why home not in good repair: no one to do this with or help","Yes , No , Not applicable ","object","Why_home_not_in_good_repair_no_one_to_do_this_with_or_help"
"HOMENT6","Why home not in good repair: not something I want","Yes , No , Not applicable ","object","Why_home_not_in_good_repair_not_something_I_want"
"HOMENT7","Why home not in good repair: not relevant to me","Yes , No , Not applicable ","object","Why_home_not_in_good_repair_not_relevant_to_me"
"HOMENT8","Why home not in good repair: other reason","Yes , No , Not applicable ","object","Why_home_not_in_good_repair_other_reason"
"HOMENT9","Do not know","Yes , No , Not applicable ","object","Do_not_know"
"HOUSHE1","are you able to keep this accommodation warm enough","Yes , No , Does not apply ","object","are_you_able_to_keep_this_accommodation_warm_enough"
"HOUSHEW","You not able to keep the accom warm enough Is that because","You don't want/need to , You would like to but can't afford to , Or some other reason ","object","You_not_able_to_keep_the_accom_warm_enough_Is_that_because"
"INTNTNT1","Why no internet access for personal use: No money for this","Yes , No , None ","object","Why_no_internet_access_for_personal_use_No_money_for_this"
"INTNTNT2","Why no internet access for personal use: Not priority on current income","Yes , No , None ","object","Why_no_internet_access_for_personal_use_Not_priority_on_curren"
"INTNTNT3","Why no internet access for personal use: Health,disability prevents me","Yes , No , None ","object","Why_no_internet_access_for_personal_use_Healthdisability_preve"
"INTNTNT4","Why no internet access for personal use: Too much trouble,too tiring","Yes , No , None ","object","Why_no_internet_access_for_personal_use_Too_much_troubletoo_ti"
"INTNTNT5","Why no internet access for personal use: No one to do this with or help me","Yes , No , None ","object","Why_no_internet_access_for_personal_use_No_one_to_do_this_with"
"INTNTNT6","Why no internet access for personal use: Not something I want","Yes , No , None ","object","Why_no_internet_access_for_personal_use_Not_something_I_want"
"INTNTNT7","Why no internet access for personal use: Not relevant to me","Yes , No , None ","object","Why_no_internet_access_for_personal_use_Not_relevant_to_me"
"INTNTNT8","Why no internet access for personal use: Other reason","Yes , No , None ","object","Why_no_internet_access_for_personal_use_Other_reason"
"INTRNET","Do you have internet access for personal use?","Adult(s) have this , Adult(s) would like to have this but cannot afford , Adult(s) do not want / need this , Does not apply ","object","Do_you_have_internet_access_for_personal_use"
"ISSUE","Whether Mainstage or Reissue","Mainstage , Reissue ","object","Whether_Mainstage_or_Reissue"
"KIDINC",">1 child in BU any get inc from job,trust","Yes , No ","object","1_child_in_BU_any_get_inc_from_jobtrust"
"MEAL","Do you get friends or family around for a drink or meal at least once a month","Adult(s) have this , Adult(s) would like to have this but cannot afford , Adult(s) do not want / need this , Does not apply ","object","Do_you_get_friends_or_family_around_for_a_drink_or_meal_at_lea"
"MEALNT1","Why no meal: no money for this","Yes , No , Not applicable ","object","Why_no_meal_no_money_for_this"
"MEALNT2","Why no meal: not priority on current income","Yes , No , Not applicable ","object","Why_no_meal_not_priority_on_current_income"
"MEALNT3","Why no meal: health,disability prevents me","Yes , No , Not applicable ","object","Why_no_meal_healthdisability_prevents_me"
"MEALNT4","Why no meal: too much trouble,too tiring","Yes , No , Not applicable ","object","Why_no_meal_too_much_troubletoo_tiring"
"MEALNT5","Why no meal: no one to do this with or help me","Yes , No , Not applicable ","object","Why_no_meal_no_one_to_do_this_with_or_help_me"
"MEALNT6","Why no meal: not something I want","Yes , No , Not applicable ","object","Why_no_meal_not_something_I_want"
"MEALNT7","Why no meal: not relevant to me","Yes , No , Not applicable ","object","Why_no_meal_not_relevant_to_me"
"MEALNT8","Why no meal: other reason","Yes , No , Not applicable ","object","Why_no_meal_other_reason"
"MEALNT9","Do not know","Yes , No , Not applicable ","object","Do_not_know"
"NHHCHILD","Whether any external child in education","Yes , No ","object","Whether_any_external_child_in_education"
"NOISE","Do you have noise from neighbours or street","Yes , No ","object","Do_you_have_noise_from_neighbours_or_street"
"OABILL","Are you able to pay regular bills","Yes , No ","object","Are_you_able_to_pay_regular_bills"
"OACAREU1","Why do you not have access to a car - Money","Yes , No , None ","object","Why_do_you_not_have_access_to_a_car__Money"
"OACAREU2","Why do you not have access to a car - Not a priority","Yes , No , None ","object","Why_do_you_not_have_access_to_a_car__Not_a_priority"
"OACAREU3","Why do you not have access to a car - Health","Yes , No , None ","object","Why_do_you_not_have_access_to_a_car__Health"
"OACAREU4","Why do you not have access to a car - Too much trouble","Yes , No , None ","object","Why_do_you_not_have_access_to_a_car__Too_much_trouble"
"OACAREU5","Why do you not have access to a car - No Help","Yes , No , None ","object","Why_do_you_not_have_access_to_a_car__No_Help"
"OACAREU6","Why do you not have access to a car - Do not want","Yes , No , None ","object","Why_do_you_not_have_access_to_a_car__Do_not_want"
"OACAREU7","Why do you not have access to a car - Other reason","Yes , No , None ","object","Why_do_you_not_have_access_to_a_car__Other_reason"
"OACAREU8","Why do you not have access to a car - Dont Know","Yes , No , None ","object","Why_do_you_not_have_access_to_a_car__Dont_Know"
"OACOAT","Do you have a warm waterproof coat","Yes , No ","object","Do_you_have_a_warm_waterproof_coat"
"OACOOK","Would you be able to replace your cooker if it broke down","Yes , No ","object","Would_you_be_able_to_replace_your_cooker_if_it_broke_down"
"OADAMP","Do you have a damp-free home","Yes , No ","object","Do_you_have_a_dampfree_home"
"OADEP2","Do you have a small amount of money to spend each week on yourself (not on your family)?","Yes , No ","object","Do_you_have_a_small_amount_of_money_to_spend_each_week_on_your"
"OADP2NT1","No money each week for personal use: No money for this","Yes , No ","object","No_money_each_week_for_personal_use_No_money_for_this"
"OADP2NT2","No money each week for personal use: Not priority on current income","Yes , No ","object","No_money_each_week_for_personal_use_Not_priority_on_current_in"
"OADP2NT3","No money each week for personal use: Health,disability prevents me","Yes , No ","object","No_money_each_week_for_personal_use_Healthdisability_prevents_"
"OADP2NT4","No money each week for personal use: Too much trouble,too tired","Yes , No ","object","No_money_each_week_for_personal_use_Too_much_troubletoo_tired"
"OADP2NT5","No money each week for personal use: No one to do this with or help me","Yes , No ","object","No_money_each_week_for_personal_use_No_one_to_do_this_with_or_"
"OADP2NT6","No money each week for personal use: Not something I want","Yes , No ","object","No_money_each_week_for_personal_use_Not_something_I_want"
"OADP2NT7","No money each week for personal use: Not relevant to me","Yes , No ","object","No_money_each_week_for_personal_use_Not_relevant_to_me"
"OADP2NT8","No money each week for personal use: Other reason","Yes , No ","object","No_money_each_week_for_personal_use_Other_reason"
"OAEUSMEA","During the last fortnight did you not have a substantial meal due to lack of money?","Yes , No ","object","During_the_last_fortnight_did_you_not_have_a_substantial_meal_"
"OAEXPNS","Would you be able to pay an unexpected expense of £200","Yes , No ","object","Would_you_be_able_to_pay_an_unexpected_expense_of_200"
"OAFRND","Do you see your friends or family at least once a month","Yes , No ","object","Do_you_see_your_friends_or_family_at_least_once_a_month"
"OAFUR","Do you replace worn out furniture?","Yes , No ","object","Do_you_replace_worn_out_furniture"
"OAHAIR","Do you have your hair done or cut regularly","Yes , No ","object","Do_you_have_your_hair_done_or_cut_regularly"
"OAHEAT","Are your heating, electrics, plumbing and drains working","Yes , No ","object","Are_your_heating_electrics_plumbing_and_drains_working"
"OAHOL","Do you take a holiday away from home","Yes , No ","object","Do_you_take_a_holiday_away_from_home"
"OAHOLB","Do you take a holiday away from home?","We/I have this , We/I  would like to have this but cannot afford this at the , We/I do not want / need this at the moment , Does not apply ","object","Do_you_take_a_holiday_away_from_home"
"OAHOME","Is your home kept in a good state of repair","Yes , No ","object","Is_your_home_kept_in_a_good_state_of_repair"
"OAHOWPY1","How pay £200: use own income but cut back on essentials","Yes , No , Not applicable ","object","How_pay_200_use_own_income_but_cut_back_on_essentials"
"OAHOWPY2","How pay £200: use own income not cut back on essentials","Yes , No , Not applicable ","object","How_pay_200_use_own_income_not_cut_back_on_essentials"
"OAHOWPY3","How pay £200: use savings","Yes , No , Not applicable ","object","How_pay_200_use_savings"
"OAHOWPY4","How pay £200: use a form of credit","Yes , No , Not applicable ","object","How_pay_200_use_a_form_of_credit"
"OAHOWPY5","How pay £200: get the money from friends,family as gift,loan","Yes , No , Not applicable ","object","How_pay_200_get_the_money_from_friendsfamily_as_giftloan"
"OAHOWPY6","How pay £200: other","Yes , No , Not applicable ","object","How_pay_200_other"
"OAINTERN","Do you have internet access for personal use?","Yes , No ","object","Do_you_have_internet_access_for_personal_use"
"OAMEAL","Do you eat at least one filling meal a day","Yes , No ","object","Do_you_eat_at_least_one_filling_meal_a_day"
"OAOUT","Do you go out socially at least once a month","Yes , No ","object","Do_you_go_out_socially_at_least_once_a_month"
"OAPHON","Do you have telephone (landline)to use, whenever you need it","Yes , No ","object","Do_you_have_telephone_landlineto_use_whenever_you_need_it"
"OAPRE","Whether respondent agreed to pensioner deprivation questions","Continue , Refusal ","object","Whether_respondent_agreed_to_pensioner_deprivation_questions"
"OAROAST","Does your household have a roast joint (","We/I have this , We/I  would like to have this but cannot afford this at the , We/I do not want / need this at the moment , Does not apply ","object","Does_your_household_have_a_roast_joint_"
"OATAXI","Do you have access to a car or taxi, whenever you need it","Yes , No ","object","Do_you_have_access_to_a_car_or_taxi_whenever_you_need_it"
"OATAXIEU","Do you have continuous access to a car and,or taxi","Car , Taxi , Both a car and a taxi? ","object","Do_you_have_continuous_access_to_a_car_andor_taxi"
"OATELEP1","Why no mobile: I do not have the money for this","Yes , No , None ","object","Why_no_mobile_I_do_not_have_the_money_for_this"
"OATELEP2","Why no mobile: not a priority for me on my current income","Yes , No , None ","object","Why_no_mobile_not_a_priority_for_me_on_my_current_income"
"OATELEP3","Why no mobile: my health,disability prevents me","Yes , No , None ","object","Why_no_mobile_my_healthdisability_prevents_me"
"OATELEP4","Why no mobile: it is too much trouble,too tiring","Yes , No , None ","object","Why_no_mobile_it_is_too_much_troubletoo_tiring"
"OATELEP5","Why no mobile: there is no one to do this with me,help me","Yes , No , None ","object","Why_no_mobile_there_is_no_one_to_do_this_with_mehelp_me"
"OATELEP6","Why no mobile: this is not something I want","Yes , No , None ","object","Why_no_mobile_this_is_not_something_I_want"
"OATELEP7","Why no mobile: it is not relevant to me","Yes , No , None ","object","Why_no_mobile_it_is_not_relevant_to_me"
"OATELEP8","Why no mobile: other reason","Yes , No , None ","object","Why_no_mobile_other_reason"
"OATELEPH","Do you have telephone (mobile) to use, whenever you need it","Yes , No ","object","Do_you_have_telephone_mobile_to_use_whenever_you_need_it"
"OAWARM","Is your home kept adequately warm","Yes , No ","object","Is_your_home_kept_adequately_warm"
"OUTNT1","Why not go out: no money for this","Yes , No , Not applicable ","object","Why_not_go_out_no_money_for_this"
"OUTNT2","Why not go out: not priority on current income","Yes , No , Not applicable ","object","Why_not_go_out_not_priority_on_current_income"
"OUTNT3","Why not go out: health,disability prevents me","Yes , No , Not applicable ","object","Why_not_go_out_healthdisability_prevents_me"
"OUTNT4","Why not go out: too much trouble,too tiring","Yes , No , Not applicable ","object","Why_not_go_out_too_much_troubletoo_tiring"
"OUTNT5","Why not go out: no one to do this with or help me","Yes , No , Not applicable ","object","Why_not_go_out_no_one_to_do_this_with_or_help_me"
"OUTNT6","Why not go out: not something I want","Yes , No , Not applicable ","object","Why_not_go_out_not_something_I_want"
"OUTNT7","Why not go out: not relevant to me","Yes , No , Not applicable ","object","Why_not_go_out_not_relevant_to_me"
"OUTNT8","Why not go out: other reason","Yes , No , Not applicable ","object","Why_not_go_out_other_reason"
"OUTNT9","Do not know","Yes , No , Not applicable ","object","Do_not_know"
"OUTPAY","Making regular payments to friends or rel outside hhold","Yes , No ","object","Making_regular_payments_to_friends_or_rel_outside_hhold"
"OUTPYAMT","How much give to friends and rel outside hhold each month","","float64","How_much_give_to_friends_and_rel_outside_hhold_each_month"
"PHONNT1","Why no phone: no money for this","Yes , No , Not applicable ","object","Why_no_phone_no_money_for_this"
"PHONNT2","Why no phone: not priority on current income","Yes , No , Not applicable ","object","Why_no_phone_not_priority_on_current_income"
"PHONNT3","Why no phone: health,disability prevents me","Yes , No , Not applicable ","object","Why_no_phone_healthdisability_prevents_me"
"PHONNT4","Why no phone: too much trouble,too tiring","Yes , No , Not applicable ","object","Why_no_phone_too_much_troubletoo_tiring"
"PHONNT5","Why no phone: no one to do this with or help me","Yes , No , Not applicable ","object","Why_no_phone_no_one_to_do_this_with_or_help_me"
"PHONNT6","Why no phone: not something I want","Yes , No , Not applicable ","object","Why_no_phone_not_something_I_want"
"PHONNT7","Why no phone: not relevant to me","Yes , No , Not applicable ","object","Why_no_phone_not_relevant_to_me"
"PHONNT8","Why no phone: other reason","Yes , No , Not applicable ","object","Why_no_phone_other_reason"
"PHONNT9","Do not know","Yes , No , Not applicable ","object","Do_not_know"
"POLLUTE","Do you have pollution,grime etc caused by traffic,industry","Yes , No ","object","Do_you_have_pollutiongrime_etc_caused_by_trafficindustry"
"REGPAMT","How much receive from friends and rels each month","","float64","How_much_receive_from_friends_and_rels_each_month"
"REGULARP","Receiving reg payments from friends or rels outside hhold","Yes , No ","object","Receiving_reg_payments_from_friends_or_rels_outside_hhold"
"REPAYBUR","Whether repayment of loans is a burden","A heavy burden or struggle , A slight burden or struggle , Not a burden or struggle at all ","object","Whether_repayment_of_loans_is_a_burden"
"SHOE","Do you have two pairs of properly fitting shoes, including a pair of all weather shoes?","Adult(s) have this , Adult(s) would like to have this but cannot afford , Adult(s) do not want / need this , Does not apply ","object","Do_you_have_two_pairs_of_properly_fitting_shoes_including_a_pa"
"SHOENT1","Why no fitting shoes: No money for this","Yes , No , None ","object","Why_no_fitting_shoes_No_money_for_this"
"SHOENT2","Why no fitting shoes: Not priority on current income","Yes , No , None ","object","Why_no_fitting_shoes_Not_priority_on_current_income"
"SHOENT3","Why no fitting shoes: Health,disability prevents me","Yes , No , None ","object","Why_no_fitting_shoes_Healthdisability_prevents_me"
"SHOENT4","Why no fitting shoes: Too much trouble,too tiring","Yes , No , None ","object","Why_no_fitting_shoes_Too_much_troubletoo_tiring"
"SHOENT5","Why no fitting shoes: No one to do this with or help me","Yes , No , None ","object","Why_no_fitting_shoes_No_one_to_do_this_with_or_help_me"
"SHOENT6","Why no fitting shoes: Not something I want","Yes , No , None ","object","Why_no_fitting_shoes_Not_something_I_want"
"SHOENT7","Why no fitting shoes: Not relevant to me","Yes , No , None ","object","Why_no_fitting_shoes_Not_relevant_to_me"
"SHOENT8","Why no fitting shoes: Other reason","Yes , No , None ","object","Why_no_fitting_shoes_Other_reason"
"SHOEOA","Do you have two pairs of properly fitting shoes, including a pair of all weather shoes?","Yes , No ","object","Do_you_have_two_pairs_of_properly_fitting_shoes_including_a_pa"
"TAXINT1","Why no car,taxi: no money for this","Yes , No , Not applicable ","object","Why_no_cartaxi_no_money_for_this"
"TAXINT2","Why no car,taxi: not priority on current income","Yes , No , Not applicable ","object","Why_no_cartaxi_not_priority_on_current_income"
"TAXINT3","Why no car,taxi: health,disability prevents me","Yes , No , Not applicable ","object","Why_no_cartaxi_healthdisability_prevents_me"
"TAXINT4","Why no car,taxi: too much trouble,too tiring","Yes , No , Not applicable ","object","Why_no_cartaxi_too_much_troubletoo_tiring"
"TAXINT5","Why no car,taxi: no one to do this with or help me","Yes , No , Not applicable ","object","Why_no_cartaxi_no_one_to_do_this_with_or_help_me"
"TAXINT6","Why no car,taxi: not something I want","Yes , No , Not applicable ","object","Why_no_cartaxi_not_something_I_want"
"TAXINT7","Why no car,taxi: not relevant to me","Yes , No , Not applicable ","object","Why_no_cartaxi_not_relevant_to_me"
"TAXINT8","Why no car,taxi: other reason","Yes , No , Not applicable ","object","Why_no_cartaxi_other_reason"
"TAXINT9","Do not know","Yes , No , Not applicable ","object","Do_not_know"
"TOTSAV","Estimated value of accounts,investments","Less than 1,500 , From 1,500 up to 3,000 , From 3,000 up to 8,000 , From 8,000 up to 20,000 , From 20,000 up to 25,000 , From 25,000 up to 30,000 , From 30,000 up to 35,000 , From 35,000 up to 40,000 , Over 40,000 , Does not wish to say ","object","Estimated_value_of_accountsinvestments"
"WARMNT1","Why home not warm: no money for this","Yes , No , Not applicable ","object","Why_home_not_warm_no_money_for_this"
"WARMNT2","Why home not warm: not priority on current income","Yes , No , Not applicable ","object","Why_home_not_warm_not_priority_on_current_income"
"WARMNT3","Why home not warm: health,disability prevents me","Yes , No , Not applicable ","object","Why_home_not_warm_healthdisability_prevents_me"
"WARMNT4","Why home not warm: too much trouble,too tiring","Yes , No , Not applicable ","object","Why_home_not_warm_too_much_troubletoo_tiring"
"WARMNT5","Why home not warm: no one to do this with or help me","Yes , No , Not applicable ","object","Why_home_not_warm_no_one_to_do_this_with_or_help_me"
"WARMNT6","Why home not warm: not something I want","Yes , No , Not applicable ","object","Why_home_not_warm_not_something_I_want"
"WARMNT7","Why home not warm: not relevant to me","Yes , No , Not applicable ","object","Why_home_not_warm_not_relevant_to_me"
"WARMNT8","Why home not warm: other reason","Yes , No , Not applicable ","object","Why_home_not_warm_other_reason"
"WARMNT9","Do not know","Yes , No , Not applicable ","object","Do_not_know"
"WASHMACH","Does your household have a washing machine","Yes , No ","object","Does_your_household_have_a_washing_machine"
"WASHWHY","Your hhold doesnt have a washing machine Is that because","Don't want one , Would like one but cannot afford it , Or is there some other reason? ","object","Your_hhold_doesnt_have_a_washing_machine_Is_that_because"
"WHODEPQ","Person from BU present for BU section?","Yes , No ","object","Person_from_BU_present_for_BU_section"
"MONTH_","Month code (Source)","","int64","Month_code_Source"
"ADULTB","Number of adults in BU","","int64","Number_of_adults_in_BU"
"BOARDER","Rent - paid by Boarder","","float64","Rent__paid_by_Boarder"
"BPENINC","BU - Pension income","","int64","BU__Pension_income"
"BSEINC","BU - Gross Self-Employment Earnings","","int64","BU__Gross_SelfEmployment_Earnings"
"BUAGEGR2","Revised Age of Head of BU (Pub)","Age 16 to 24 , Age 25 to 34 , Age 35 to 44 , Age 45 to 54 , Age 55 to 59 , Age 60 to 64 , Age 65 to 74 , Age 75 to 84 , Age 85 or over ","int64","Revised_Age_of_Head_of_BU_Pub"
"BUAGEGR3","Age of Head of BU - 10 Year Age Bands - Anon","Age 16 to 24 , Age 25 to 34 , Age 35 to 44 , Age 45 to 54 , Age 55 to 59 , Age 60 to 64 , Age 65 to 74 , Age 75 or over ","object","Age_of_Head_of_BU__10_Year_Age_Bands__Anon"
"BUAGEGR4","Age of Head of BU - 5 Year Age Bands - Anon","Age 16 to 19 , Age 20 to 24 , Age 25 to 29 , Age 30 to 34 , Age 35 to 39 , Age 40 to 44 , Age 45 to 49 , Age 50 to 54 , Age 55 to 59 , Age 60 to 64 , Age 65 to 69 , Age 70 to 74 , Age 75 or over ","object","Age_of_Head_of_BU__5_Year_Age_Bands__Anon"
"BUAGEGRP","Age of Head of Benefit Unit-Pub","Age 16 to 19 , Age 20 to 24 , Age 25 to 29 , Age 30 to 34 , Age 35 to 39 , Age 40 to 44 , Age 45 to 49 , Age 50 to 54 , Age 55 to 59 , Age 60 to 64 , Age 65 to 69 , Age 70 to 74 , Age 75 to 79 , Age 80 to 84 , Age 85 or over ","int64","Age_of_Head_of_Benefit_UnitPub"
"BUDISBEN","BU - Disability benefits","","int64","BU__Disability_benefits"
"BUEARNS","BU - Gross Income from Employment","","int64","BU__Gross_Income_from_Employment"
"BUETH","Ethnicity of Head of Benunit","White , Mixed / Multiple ethnic groups , Asian - Indian , Asian - Pakistani , Asian - Bangladeshi , Asian - Chinese , Asian - Other , Black/ African/ Caribbean/ Black British , Other ethnic group ","object","Ethnicity_of_Head_of_Benunit"
"BUETHGR3","Ethnicity of Head of Benunit","White , Mixed/ Multiple ethnic groups , Asian/ Asian British , Black/ African/ Caribbean/ Black British , Other ethnic group ","object","Ethnicity_of_Head_of_Benunit"
"BUINC","BU - Total Income (gross)","","int64","BU__Total_Income_gross"
"BUINV","BU - Investment income","","int64","BU__Investment_income"
"BUIRBEN","BU - income related benefits","","int64","BU__income_related_benefits"
"BUKIDS","No Children in BU by No Parents -Pub","Couple - One Child , Couple - Two Children , Couple - Three Children , Couple - Four or more Children , Lone Parent - One Child , Lone Parent - Two Children , Lone Parent - Three Children , Lone Parent - Four or more Children ","object","No_Children_in_BU_by_No_Parents_Pub"
"BUNIRBEN","BU - non income related benefits (gross)","","int64","BU__non_income_related_benefits_gross"
"BUOTHBEN","BU BU - Other benefits (gross)","","int64","BU_BU__Other_benefits_gross"
"BURENT","Gross Rent for BU","","int64","Gross_Rent_for_BU"
"BURINC","BU - Remaining income","","int64","BU__Remaining_income"
"BURPINC","Retirement pension + IS","","int64","Retirement_pension__IS"
"BUTVLIC","BU - Amount of Income from free TV licences","","float64","BU__Amount_of_Income_from_free_TV_licences"
"BUTXCRED","BU - Amount of Tax Credits Received","","int64","BU__Amount_of_Tax_Credits_Received"
